[
  {
    "id": "conversation-fixture-alpha",
    "trendId": "trend-fixture-alpha",
    "questions": [
      {
        "id": "q-alpha-conversation-one",
        "text": "zebra-alpha-conversation-one: whom outside the company could you ask about this synthetic change?"
      },
      {
        "id": "q-alpha-conversation-two",
        "text": "zebra-alpha-conversation-two: whom outside the company could you ask about this synthetic change?"
      }
    ],
    "label": "ai-generated",
    "provenance": {
      "sourceUrl": null,
      "publisher": null,
      "publishedOn": null,
      "retrievedOn": null,
      "producedBy": [
        "interrogator"
      ],
      "producedOn": "2026-10-04",
      "frozenOn": "2026-10-05"
    }
  },
  {
    "id": "conversation-fixture-beta",
    "trendId": "trend-fixture-beta",
    "questions": [
      {
        "id": "q-beta-conversation-one",
        "text": "zebra-beta-conversation-one: whom outside the company could you ask about this synthetic change?"
      },
      {
        "id": "q-beta-conversation-two",
        "text": "zebra-beta-conversation-two: whom outside the company could you ask about this synthetic change?"
      },
      {
        "id": "q-beta-conversation-three",
        "text": "zebra-beta-conversation-three: whom outside the company could you ask about this synthetic change?"
      }
    ],
    "label": "ai-generated",
    "provenance": {
      "sourceUrl": null,
      "publisher": null,
      "publishedOn": null,
      "retrievedOn": null,
      "producedBy": [
        "interrogator"
      ],
      "producedOn": "2026-10-04",
      "frozenOn": "2026-10-05"
    }
  }
]
